Department Number,Department Name,Department Description
94,Transportation,"This Department is responsible for the development of plans to meet the ground transportation needs of the traveling public and commerce; it has centralized authority over the conceptual planning and operation of the City's streets and highways system; and it provides a primary interface with other governmental agencies on transportation matters. The Department studies parking and traffic needs; provides for the installation and maintenance of traffic signs, signals, parking meters, street name signs, and other transportation control devices; controls traffic and pedestrian movement at all intersections; enforces parking rules and regulations and accounts for all revenue therefrom; coordinates the development of off-street parking; oversees crossing guard services; provides public utility regulation through investigation of services and rates of the privately owned public utilities; regulates the rates and services of taxicabs, ambulances, and sightseeing vehicles, and issues permits to drivers of public transportation vehicles; prepares and enforces provisions of franchises; and audits franchise payments."
16A,Appropriations to City Employees' Retirement,"Charter Section 1160 requires the City to pay the cost of maintenance of the retirement fund, which provides retirement, disability, and death benefits for officers and employees of the City except members of the Fire and Police Pensions System and members of the Water and Power Employees' Retirement Plan. The City's General Fund contribution will be financed by the issuance of a Tax and Revenue Anticipation Note (TRAN). The Special Fund portion is the amount obligated to the Harbor, Airports, the Los Angeles City Employee's Retirement System, and the Los Angeles Fire and Police Pensions System for retirement costs for their employees."
44A,Appropriations to Library Fund,"Charter Section 531 provides that an annual sum equal to 0.0300 percent of assessed value of all property in the City as assessed for City taxes be provided for the financial support of the Library Department. The Department may request, in accordance with Charter Section 246, assistance from the Council in the performance of its functions with appropriations of money or otherwise."
53LVL4,Capital Finance Administration,"An annual sum is appropriated to make lease and other payments, including trustee and arbitrage fees, required by various non-general obligation, long-term City financing programs. These financing programs utilize a financing lease or ""lease purchase"" generally paid out of General Fund appropriations and the sale of public securities (lease revenue bonds or certificates of participation) to acquire facilities and equipment items for use by City departments."
56LVL4,General City Purposes,"These appropriations are to cover the cost of special services or purposes not chargeable to a specific department of the City.  Departments responsible for administering General City Purposes contracts are designated in the Blue Book.  Additional details related to specific items are shown in the Footnotes (see Section 2, Part IV)."
58LVL4,Unappropriated Balance,Charter Section 312 requires that an amount known as the Unappropriated Balance be included in the Budget to be available for appropriations later in the fiscal year to meet contingencies as they arise.
59LVL4,Liability Claims,"An annual sum is appropriated to this Fund for the payment or settlement of any monetary claims or legal action brought by or against the City of Los Angeles, or any officer or employee for which the City may be ultimately liable. Los Angeles Administrative Code Section 5.173 authorizes the City Attorney to settle claims and pay judgments against the City in an amount not to exceed $50,000 and an additional $50,000, not to exceed $100,000, subject to the approval of the Claims Board. Payments of settlements or claims over $100,000 must be approved by the Council with the concurrence of the Mayor."
60LVL4,Water and Electricity,An annual sum is appropriated to this Fund to reimburse the Department of Water and Power for water and electrical services rendered to departments or special purposes whose activities are financed primarily from the General Fund.
61LVL4,Human Resources Benefits,"An annual sum is appropriated to each line item in this Fund for the following purposes: (1) payment of all workers' compensation and rehabilitation bills, claims, and awards; (2) payment of subsidies for the City's benefits program; and (3) payment of unemployment insurance claims. This Fund may also be used to provide other benefits as approved by the Mayor and Council. The Personnel Department administers this Fund. All civilian Health, Dental, Disability, and Life Insurance subsidies are included in the Civilian FLEX Program line item."
88A,Appropriations to Recreation and Parks Fund,"Charter Section 593 provides that a sum is appropriated annually for the financial support of the Department of Recreation and Parks in an amount not less than 0.0325 percent of the assessed value of all property as assessed for City taxes. In accordance with Charter Section 246, the Department may request assistance from the Council in the performance of its functions with appropriations of money or otherwise."
JOBLVL4,Judgment Obligation Bonds Debt Service Fund,"An annual sum is appropriated to this Fund to pay debt service on bonds sold to finance the liabilities from the adverse decisions by the California courts against the city in the following settlements: (a) the Harper Settlement; (b) the May Day Settlement (federal case only); and (c) various judgments or stipulated judgments relating to City misconduct in connection with certain plaintiffs' City employment, inverse condemnation incidents, and personal injuries caused by city employees or on city property with final payment to occur in 2019-20."
OTHERSPF,Other Special Purpose Funds,Appropriations for items or activities not readily chargeable to a budgetary department.
S11LVL4,Special Parking Revenue Fund,The Special Parking Revenue Fund provides for the utilization of all monies collected from parking meters and City-owned parking lots in the City of Los Angeles. This schedule reflects appropriations for non-departmental items. Appropriations to departmental budgets are shown in Section 2 Part II.
S14LVL4,Wastewater Special Purpose Fund,"An annual sum is appropriated to reimburse the General Fund for the related costs (including General City Overhead) of City departments, offices and bureaus providing support to the Wastewater System Improvement Program.  Provision is made for direct payment of non-salary related expense, equipment and special costs previously budgeted in operating budgets through subventions from Sewer Construction and Maintenance funds.  An amount equal to 45 days operation and maintenance costs is reserved in accordance with the requirements of the General Resolution authorizing the Wastewater System Revenue Bonds.  Funds are appropriated for bond redemption and interest on Wastewater System Revenue bonds."
S26LVL4,Proposition A Local Transit Assistance Fund,"The Proposition A Local Transit Assistance (PALTA) Fund provides for the utilization of one-half cent sales tax revenues for the planning, administration, and operation of Citywide public transportation programs.  Proposed appropriations comply with the Proposition A Local Return Program Guidelines adopted by the Los Angeles County Transportation Commission, which administers this program approved by the voters in November 1980.  This schedule reflects appropriations for non-departmental items. Appropriations to departmental budgets are shown in Section 2 Part II and Section 2 Part III."
S27LVL4,Proposition C Anti-Gridlock Transit Improvement Fund,"The one-half cent sales tax for transit improvements, Proposition C, was approved by the voters on November 6, 1990.This schedule reflects appropriations for non-departmental items. Appropriations to departmental budgets are shown in Section 2 Part II and Section 2 Part III."
S36LVL4,Bond Redemption and Interest,These are the amounts required for the payment of principal and interest on the General Obligation Bonds of the City.
TRANLVL4,Tax and Revenue Anticipation Notes,A sum is appropriated to this Fund for payment of the entire debt service on tax and revenue anticipation notes issued to pay the annual contributions to both the Los Angeles City Employees' Retirement System (Retirement Fund) and the Fire and Police Pension Fund (Pension Fund) in July. The additional interest earned by the Pension and Retirement Funds from this early payment is used to discount the required City contribution to both Funds without reducing its annual receipts. A sum is also appropriated to this Fund for the interest portion of the debt service on notes issued to alleviate the short-term cash flow deficits that occur early in the fiscal year when certain taxes and revenues have not yet been received. The principal portion of the notes has not been appropriated in the budget since the principal is treated as temporary borrowing rather than expenditure.